{
  "eventId": "10000000-0000-4000-8000-000000000001",
  "eventType": "NotificationDelivered",
  "occurredAt": "2026-10-05T12:00:00Z",
  "producer": "NotificationService",
  "schemaVersion": "1.0.0",
  "correlationId": "10000000-0000-4000-8000-000000000001",
  "projectId": "10000000-0000-4000-8000-000000000001",
  "payload": {
    "notificationId": "10000000-0000-4000-8000-000000000001",
    "deliveryReceipt": "receipt-1",
    "deliveredAt": "2026-10-05T12:00:00Z"
  }
}
